{
  "schemaVersion": 1,
  "generatedAt": "2026-07-26T20:11:52Z",
  "signatureStatus": "unsignedDevelopment",
  "packages": [
    {
      "id": "anti-shuffle",
      "slug": "anti-shuffle",
      "type": "weaveMod",
      "name": "AntiShuffle",
      "summary": "Required source was named as a Weave community project but is no longer publicly accessible.",
      "description": "Required source was named as a Weave community project but is no longer publicly accessible.",
      "localizations": {
        "en": {
          "name": "AntiShuffle",
          "summary": "Required source was named as a Weave community project but is no longer publicly accessible.",
          "description": "Required source was named as a Weave community project but is no longer publicly accessible.",
          "warnings": [
            "The upstream repository returned 404; no metadata or binary could be verified."
          ],
          "changelog": ""
        },
        "ru": {
          "name": "AntiShuffle",
          "summary": "Указанный в задании проект сообщества Weave больше не доступен публично.",
          "description": "Указанный в задании проект сообщества Weave больше не доступен публично.",
          "warnings": [
            "Репозиторий автора вернул 404; метаданные и бинарный файл проверить не удалось."
          ],
          "changelog": ""
        }
      },
      "authors": [
        {
          "name": "ballmc",
          "url": "https://github.com/ballmc"
        }
      ],
      "homepage": "https://github.com/ballmc/AntiShuffle",
      "repository": "https://github.com/ballmc/AntiShuffle",
      "license": null,
      "tags": [],
      "icon": "https://zoongg.github.io/Moonrise-Catalog/assets/packages/weave-mod.svg",
      "screenshots": [],
      "supportedMinecraftVersions": [],
      "supportedClientVersions": [],
      "archived": false,
      "riskLevel": "unknown",
      "installPolicy": "unavailable",
      "restricted": false,
      "featured": false,
      "recommended": false,
      "releases": [],
      "dependencies": [],
      "conflicts": [],
      "warnings": [
        {
          "code": "missing-repository",
          "message": "The upstream repository returned 404; no metadata or binary could be verified.",
          "localizedMessage": {
            "en": "The upstream repository returned 404; no metadata or binary could be verified.",
            "ru": "Репозиторий автора вернул 404; метаданные и бинарный файл проверить не удалось."
          }
        }
      ],
      "statistics": {
        "downloads": null,
        "moonriseInstalls": 0
      }
    },
    {
      "id": "atw-levelhead",
      "slug": "atw-levelhead",
      "type": "weaveMod",
      "name": "ATW LevelHead",
      "summary": "Adds Hypixel LevelHead tags, BedWars tab statistics, chat lookups, and a threat overview.",
      "description": "Adds Hypixel LevelHead tags, BedWars tab statistics, chat lookups, and a threat overview.",
      "localizations": {
        "en": {
          "name": "ATW LevelHead",
          "summary": "Adds Hypixel LevelHead tags, BedWars tab statistics, chat lookups, and a threat overview.",
          "description": "Adds Hypixel LevelHead tags, BedWars tab statistics, chat lookups, and a threat overview.",
          "warnings": [
            "No clear upstream license was found. Moonrise does not redistribute this binary."
          ],
          "changelog": "Upstream release."
        },
        "ru": {
          "name": "ATW LevelHead",
          "summary": "Добавляет теги Hypixel LevelHead, статистику BedWars в tab, запросы из чата и обзор угроз.",
          "description": "Добавляет теги Hypixel LevelHead, статистику BedWars в tab, запросы из чата и обзор угроз.",
          "warnings": [
            "Явная лицензия вышестоящего проекта не найдена. Moonrise не распространяет этот бинарный файл."
          ],
          "changelog": "Релиз вышестоящего проекта."
        }
      },
      "authors": [
        {
          "name": "alextyhwang",
          "url": "https://github.com/alextyhwang"
        }
      ],
      "homepage": "https://github.com/alextyhwang/ATWs-Levelhead/releases/tag/0.2.2",
      "repository": "https://github.com/alextyhwang/ATWs-Levelhead",
      "license": null,
      "tags": [],
      "icon": "https://zoongg.github.io/Moonrise-Catalog/assets/packages/weave-mod.svg",
      "screenshots": [],
      "supportedMinecraftVersions": [
        "1.8.9"
      ],
      "supportedClientVersions": [
        "Lunar Client"
      ],
      "archived": false,
      "riskLevel": "serverDependent",
      "installPolicy": "externalDownload",
      "restricted": false,
      "featured": false,
      "recommended": false,
      "releases": [
        {
          "version": "0.2.2",
          "publishedAt": "2026-06-18T22:15:47Z",
          "changelog": "Upstream release.",
          "localizedChangelog": {
            "en": "Upstream release.",
            "ru": "Релиз вышестоящего проекта."
          },
          "artifact": {
            "downloadMode": "externalPage",
            "assetUrl": "https://github.com/alextyhwang/ATWs-Levelhead/releases/download/0.2.2/ATWLevelHead-0.2.2.jar",
            "upstreamReleaseUrl": "https://github.com/alextyhwang/ATWs-Levelhead/releases/tag/0.2.2",
            "fileName": "ATWLevelHead-0.2.2.jar",
            "fileSize": 86316,
            "sha256": "8e17f5b15fcde9ba4b7fabb1496dd0a32ae51c761d83dd809733f0bd669abda9",
            "javaVersion": null,
            "weaveLoaderRange": null,
            "minecraftVersions": [
              "1.8.9"
            ]
          },
          "dependencies": [],
          "conflicts": []
        }
      ],
      "dependencies": [],
      "conflicts": [],
      "warnings": [
        {
          "code": "missing-license",
          "message": "No clear upstream license was found. Moonrise does not redistribute this binary.",
          "localizedMessage": {
            "en": "No clear upstream license was found. Moonrise does not redistribute this binary.",
            "ru": "Явная лицензия вышестоящего проекта не найдена. Moonrise не распространяет этот бинарный файл."
          }
        }
      ],
      "statistics": {
        "downloads": null,
        "moonriseInstalls": 0
      }
    },
    {
      "id": "celestial",
      "slug": "celestial",
      "type": "weaveMod",
      "name": "Celestial",
      "summary": "Adds Hypixel BedWars statistics, hover statistics, keybinds, and settings to Lunar Client through Weave.",
      "description": "Adds Hypixel BedWars statistics, hover statistics, keybinds, and settings to Lunar Client through Weave.",
      "localizations": {
        "en": {
          "name": "Celestial",
          "summary": "Adds Hypixel BedWars statistics, hover statistics, keybinds, and settings to Lunar Client through Weave.",
          "description": "Adds Hypixel BedWars statistics, hover statistics, keybinds, and settings to Lunar Client through Weave.",
          "warnings": [],
          "changelog": "Upstream release."
        },
        "ru": {
          "name": "Celestial",
          "summary": "Добавляет статистику Hypixel BedWars, статистику при наведении, клавиши и настройки в Lunar Client через Weave.",
          "description": "Добавляет статистику Hypixel BedWars, статистику при наведении, клавиши и настройки в Lunar Client через Weave.",
          "warnings": [],
          "changelog": "Релиз вышестоящего проекта."
        }
      },
      "authors": [
        {
          "name": "Candicey",
          "url": "https://gitlab.com/Candicey"
        },
        {
          "name": "Monmcgt",
          "url": "https://github.com/Monmcgt"
        }
      ],
      "homepage": "https://github.com/Monmcgt/LunarAgent-Weave/releases/tag/v0.1.0",
      "repository": "https://gitlab.com/Candicey/lunar-agent",
      "license": {
        "name": "GPL-3.0-only",
        "url": "https://gitlab.com/Candicey/lunar-agent/blob/master/LICENSE"
      },
      "tags": [],
      "icon": "https://zoongg.github.io/Moonrise-Catalog/assets/packages/weave-mod.svg",
      "screenshots": [],
      "supportedMinecraftVersions": [],
      "supportedClientVersions": [
        "Lunar Client"
      ],
      "archived": false,
      "riskLevel": "serverDependent",
      "installPolicy": "oneClick",
      "restricted": false,
      "featured": false,
      "recommended": false,
      "releases": [
        {
          "version": "0.1.0",
          "publishedAt": "2023-03-22T20:29:54Z",
          "changelog": "Upstream release.",
          "localizedChangelog": {
            "en": "Upstream release.",
            "ru": "Релиз вышестоящего проекта."
          },
          "artifact": {
            "downloadMode": "githubRelease",
            "assetUrl": "https://github.com/Monmcgt/LunarAgent-Weave/releases/download/v0.1.0/Lunar-Agent-0.1.0.jar",
            "upstreamReleaseUrl": "https://github.com/Monmcgt/LunarAgent-Weave/releases/tag/v0.1.0",
            "fileName": "Lunar-Agent-0.1.0.jar",
            "fileSize": 402792,
            "sha256": "d7ea08fddecaa37a3d85fe6157a2ff1a25485cc9930ac68d498bcefecbc4aa8d",
            "javaVersion": null,
            "weaveLoaderRange": null,
            "minecraftVersions": []
          },
          "dependencies": [],
          "conflicts": []
        }
      ],
      "dependencies": [],
      "conflicts": [],
      "warnings": [],
      "statistics": {
        "downloads": null,
        "moonriseInstalls": 0
      }
    },
    {
      "id": "cracked-account",
      "slug": "cracked-account",
      "type": "javaAgent",
      "name": "CrackedAccount",
      "summary": "Changes Lunar Client account behavior for single-player and offline-mode servers.",
      "description": "Changes Lunar Client account behavior for single-player and offline-mode servers.",
      "localizations": {
        "en": {
          "name": "CrackedAccount",